{
  "version": "people-seed-v1",
  "generatedAt": "2026-08-02T04:41:32.516Z",
  "status": "proposed-candidate-rollout",
  "category": "director",
  "ordering": "tmdb-person-id-ascending",
  "recordCount": 418,
  "records": [
    {
      "stableKey": "person:1",
      "tmdbPersonId": 1,
      "canonicalName": "George Lucas",
      "category": "director",
      "rolloutTier": "initial",
      "selectionBasis": [
        "tspdt-all-time"
      ],
      "sourceRanks": {
        "tspdt-directors": [
          127
        ]
      },
      "recommendedAction": "include-initial",
      "selectionStatus": "proposed",
      "ownerDecision": null,
      "ownerNote": ""
    },
    {
      "stableKey": "person:7",
      "tmdbPersonId": 7,
      "canonicalName": "Andrew Stanton",
      "category": "director",
      "rolloutTier": "review",
      "selectionBasis": [
        "tspdt-21st-century",
        "modern-supplement"
      ],
      "sourceRanks": {
        "tspdt-21c-directors": [
          71
        ]
      },
      "recommendedAction": "manual-selection-review",
      "selectionStatus": "proposed",
      "ownerDecision": null,
      "ownerNote": ""
    },
    {
      "stableKey": "person:8",
      "tmdbPersonId": 8,
      "canonicalName": "Lee Unkrich",
      "category": "director",
      "rolloutTier": "initial",
      "selectionBasis": [
        "owner-approved-v3"
      ],
      "sourceRanks": {},
      "recommendedAction": "include-initial",
      "selectionStatus": "owner-decided",
      "ownerDecision": "include",
      "ownerNote": ""
    },
    {
      "stableKey": "person:24",
      "tmdbPersonId": 24,
      "canonicalName": "Robert Zemeckis",
      "category": "director",
      "rolloutTier": "initial",
      "selectionBasis": [
        "tspdt-all-time"
      ],
      "sourceRanks": {
        "tspdt-directors": [
          125
        ]
      },
      "recommendedAction": "include-initial",
      "selectionStatus": "proposed",
      "ownerDecision": null,
      "ownerNote": ""
    },
    {
      "stableKey": "person:39",
      "tmdbPersonId": 39,
      "canonicalName": "Sam Mendes",
      "category": "director",
      "rolloutTier": "initial",
      "selectionBasis": [
        "owner-approved-v3"
      ],
      "sourceRanks": {},
      "recommendedAction": "include-initial",
      "selectionStatus": "owner-decided",
      "ownerDecision": "include",
      "ownerNote": ""
    },
    {
      "stableKey": "person:40",
      "tmdbPersonId": 40,
      "canonicalName": "Orson Welles",
      "category": "director",
      "rolloutTier": "initial",
      "selectionBasis": [
        "tspdt-all-time"
      ],
      "sourceRanks": {
        "tspdt-directors": [
          2
        ]
      },
      "recommendedAction": "include-initial",
      "selectionStatus": "proposed",
      "ownerDecision": null,
      "ownerNote": ""
    },
    {
      "stableKey": "person:42",
      "tmdbPersonId": 42,
      "canonicalName": "Lars von Trier",
      "category": "director",
      "rolloutTier": "initial",
      "selectionBasis": [
        "tspdt-all-time",
        "tspdt-21st-century",
        "cross-source"
      ],
      "sourceRanks": {
        "tspdt-21c-directors": [
          8
        ],
        "tspdt-directors": [
          77
        ]
      },
      "recommendedAction": "include-initial",
      "selectionStatus": "proposed",
      "ownerDecision": null,
      "ownerNote": ""
    },
    {
      "stableKey": "person:59",
      "tmdbPersonId": 59,
      "canonicalName": "Luc Besson",
      "category": "director",
      "rolloutTier": "initial",
      "selectionBasis": [
        "owner-approved-v3"
      ],
      "sourceRanks": {},
      "recommendedAction": "include-initial",
      "selectionStatus": "owner-decided",
      "ownerDecision": "include",
      "ownerNote": ""
    },
    {
      "stableKey": "person:68",
      "tmdbPersonId": 68,
      "canonicalName": "Fritz Lang",
      "category": "director",
      "rolloutTier": "initial",
      "selectionBasis": [
        "tspdt-all-time"
      ],
      "sourceRanks": {
        "tspdt-directors": [
          24
        ]
      },
      "recommendedAction": "include-initial",
      "selectionStatus": "proposed",
      "ownerDecision": null,
      "ownerNote": ""
    },
    {
      "stableKey": "person:108",
      "tmdbPersonId": 108,
      "canonicalName": "Peter Jackson",
      "category": "director",
      "rolloutTier": "later",
      "selectionBasis": [
        "tspdt-all-time",
        "tspdt-21st-century",
        "cross-source"
      ],
      "sourceRanks": {
        "tspdt-21c-directors": [
          37
        ],
        "tspdt-directors": [
          201
        ]
      },
      "recommendedAction": "include-later",
      "selectionStatus": "proposed",
      "ownerDecision": null,
      "ownerNote": ""
    },
    {
      "stableKey": "person:138",
      "tmdbPersonId": 138,
      "canonicalName": "Quentin Tarantino",
      "category": "director",
      "rolloutTier": "initial",
      "selectionBasis": [
        "tspdt-all-time",
        "tspdt-21st-century",
        "cross-source"
      ],
      "sourceRanks": {
        "tspdt-21c-directors": [
          22
        ],
        "tspdt-directors": [
          64
        ]
      },
      "recommendedAction": "include-initial",
      "selectionStatus": "proposed",
      "ownerDecision": null,
      "ownerNote": ""
    },
    {
      "stableKey": "person:190",
      "tmdbPersonId": 190,
      "canonicalName": "Clint Eastwood",
      "category": "director",
      "rolloutTier": "initial",
      "selectionBasis": [
        "tspdt-all-time",
        "tspdt-21st-century",
        "cross-source"
      ],
      "sourceRanks": {
        "tspdt-21c-directors": [
          48
        ],
        "tspdt-directors": [
          108
        ]
      },
      "recommendedAction": "include-initial",
      "selectionStatus": "proposed",
      "ownerDecision": null,
      "ownerNote": ""
    },
    {
      "stableKey": "person:201",
      "tmdbPersonId": 201,
      "canonicalName": "Michel Gondry",
      "category": "director",
      "rolloutTier": "later",
      "selectionBasis": [
        "tspdt-all-time",
        "tspdt-21st-century",
        "cross-source"
      ],
      "sourceRanks": {
        "tspdt-21c-directors": [
          31
        ],
        "tspdt-directors": [
          213
        ]
      },
      "recommendedAction": "include-later",
      "selectionStatus": "proposed",
      "ownerDecision": null,
      "ownerNote": ""
    },
    {
      "stableKey": "person:202",
      "tmdbPersonId": 202,
      "canonicalName": "Charlie Kaufman",
      "category": "director",
      "rolloutTier": "review",
      "selectionBasis": [
        "tspdt-21st-century",
        "modern-supplement"
      ],
      "sourceRanks": {
        "tspdt-21c-directors": [
          83
        ]
      },
      "recommendedAction": "manual-selection-review",
      "selectionStatus": "proposed",
      "ownerDecision": null,
      "ownerNote": ""
    },
    {
      "stableKey": "person:223",
      "tmdbPersonId": 223,
      "canonicalName": "Alejandro G. Iñárritu",
      "category": "director",
      "rolloutTier": "review",
      "selectionBasis": [
        "tspdt-21st-century",
        "modern-supplement"
      ],
      "sourceRanks": {
        "tspdt-21c-directors": [
          52
        ]
      },
      "recommendedAction": "manual-selection-review",
      "selectionStatus": "proposed",
      "ownerDecision": null,
      "ownerNote": ""
    },
    {
      "stableKey": "person:224",
      "tmdbPersonId": 224,
      "canonicalName": "David Cronenberg",
      "category": "director",
      "rolloutTier": "initial",
      "selectionBasis": [
        "tspdt-all-time",
        "tspdt-21st-century",
        "cross-source"
      ],
      "sourceRanks": {
        "tspdt-21c-directors": [
          59
        ],
        "tspdt-directors": [
          93
        ]
      },
      "recommendedAction": "include-initial",
      "selectionStatus": "proposed",
      "ownerDecision": null,
      "ownerNote": ""
    },
    {
      "stableKey": "person:240",
      "tmdbPersonId": 240,
      "canonicalName": "Stanley Kubrick",
      "category": "director",
      "rolloutTier": "initial",
      "selectionBasis": [
        "tspdt-all-time",
        "cross-source"
      ],
      "sourceRanks": {
        "tspdt-directors": [
          3
        ]
      },
      "recommendedAction": "include-initial",
      "selectionStatus": "proposed",
      "ownerDecision": null,
      "ownerNote": ""
    },
    {
      "stableKey": "person:280",
      "tmdbPersonId": 280,
      "canonicalName": "Terry Gilliam",
      "category": "director",
      "rolloutTier": "initial",
      "selectionBasis": [
        "tspdt-all-time"
      ],
      "sourceRanks": {
        "tspdt-directors": [
          142
        ]
      },
      "recommendedAction": "include-initial",
      "selectionStatus": "proposed",
      "ownerDecision": null,
      "ownerNote": ""
    },
    {
      "stableKey": "person:309",
      "tmdbPersonId": 309,
      "canonicalName": "Pedro Almodóvar",
      "category": "director",
      "rolloutTier": "initial",
      "selectionBasis": [
        "tspdt-all-time",
        "tspdt-21st-century",
        "cross-source"
      ],
      "sourceRanks": {
        "tspdt-21c-directors": [
          29
        ],
        "tspdt-directors": [
          99
        ]
      },
      "recommendedAction": "include-initial",
      "selectionStatus": "proposed",
      "ownerDecision": null,
      "ownerNote": ""
    },
    {
      "stableKey": "person:488",
      "tmdbPersonId": 488,
      "canonicalName": "Steven Spielberg",
      "category": "director",
      "rolloutTier": "initial",
      "selectionBasis": [
        "tspdt-all-time",
        "tspdt-21st-century",
        "cross-source"
      ],
      "sourceRanks": {
        "tspdt-21c-directors": [
          32
        ],